{
  "$schema": "../governance/program-state-schema.json",
  "schemaVersion": 1,
  "architectureVersion": "v1.0",
  "asOf": "2026-09-01",
  "status": "in_progress",
  "workOrders": [
    {
      "id": "WORK-001",
      "title": "ServiceOS Foundation",
      "status": "complete",
      "dependencies": [],
      "branch": "feat/WORK-001-foundation",
      "pr": 15,
      "implementationRevision": "a994f24d909c6db7e0d876553e4329a071fa36b7",
      "currentMainRevision": "8bf0336b25eaebed416eacb7236233149885d181",
      "activationIssue": 1,
      "assuranceProfile": "HIGH_ASSURANCE",
      "surfaceFlags": ["documentation","localBehavior","moduleInternals","multiModule","publicContracts","schema","authorityBoundary","securityTenant"],
      "surfaces": ["platform","repository governance","persistence bootstrap","API composition"],
      "coordination": null,
      "mergedAs": {"commit":"8bf0336b25eaebed416eacb7236233149885d181","pr":15,"mergedAt":"2026-08-31"}
    },
    {
      "id": "WORK-002",
      "title": "Identity/Tenancy",
      "status": "complete",
      "dependencies": ["WORK-001"],
      "branch": "feat/WORK-002-identity-tenancy",
      "pr": 17,
      "implementationRevision": "f23b681bb107c5666840e28120efab241e4f4cb6",
      "currentMainRevision": "023a9d520f414a60cedf728db8313226a2b78e75",
      "activationIssue": 16,
      "assuranceProfile": "CRITICAL",
      "surfaceFlags": ["documentation","localBehavior","moduleInternals","multiModule","publicContracts","schema","authorityBoundary","securityTenant","concurrency"],
      "surfaces": ["/auth","/organizations","authorization","tenant-scoped persistence","customer route guards"],
      "coordination": null,
      "mergedAs": {"commit":"023a9d520f414a60cedf728db8313226a2b78e75","pr":17,"mergedAt":"2026-09-01"}
    },
    {
      "id": "WORK-003",
      "title": "Service Work",
      "status": "complete",
      "dependencies": ["WORK-001"],
      "branch": "feat/WORK-003-service-work",
      "pr": 24,
      "implementationRevision": "18e022bdcff862701ac13764801fb37dae5e76d7",
      "currentMainRevision": "4ee83a28ca8777836fbc01c3d64f19447b7c64e8",
      "activationIssue": 18,
      "assuranceProfile": "CRITICAL",
      "surfaceFlags": ["documentation","localBehavior","moduleInternals","multiModule","publicContracts","schema","authorityBoundary","securityTenant","concurrency"],
      "surfaces": ["/work","ServiceWork persistence","WorkAttempt persistence","dependency/idempotency records"],
      "coordination": null,
      "mergedAs": {"commit":"4ee83a28ca8777836fbc01c3d64f19447b7c64e8","pr":24,"mergedAt":"2026-09-01"}
    }
  ],
  "decisions": [
    {"id":"ADR-0001","summary":"ServiceOS delegates all AI execution to Zeck."}
  ],
  "resumption": {
    "activeHandoffs": [],
    "rule":"A fresh Architect reads repository state before selecting work."
  }
}
